[
  {
    "id": "google-vrp",
    "name": "Google Vulnerability Reward Program",
    "organization": "Google",
    "platform": "Direct / Self-Hosted",
    "program_type": "Bug Bounty",
    "url": "https://bughunters.google.com/",
    "policy_url": "https://bughunters.google.com/about/rules",
    "max_bounty_usd": 150000.0,
    "min_bounty_usd": 100.0,
    "reward_types": [
      "Cash",
      "Swag",
      "Hall of Fame"
    ],
    "scope_summary": [
      "*.google.com",
      "*.android.com",
      "Chromium",
      "Google Cloud"
    ],
    "out_of_scope_summary": [
      "Social Engineering",
      "Physical Attacks",
      "Third-party integrations"
    ],
    "contact_email": "security@google.com",
    "security_txt_url": "https://google.com/.well-known/security.txt",
    "tags": [
      "Cloud",
      "Mobile",
      "Web",
      "Browser",
      "Hardware"
    ],
    "status": "Active",
    "last_updated": "2026-10-13T05:04:04.806046+00:00"
  },
  {
    "id": "microsoft-msrc",
    "name": "Microsoft Security Response Center",
    "organization": "Microsoft",
    "platform": "Direct / Self-Hosted",
    "program_type": "Bug Bounty",
    "url": "https://www.microsoft.com/msrc/bounty",
    "policy_url": "https://www.microsoft.com/en-us/msrc/bounty",
    "max_bounty_usd": 250000.0,
    "min_bounty_usd": 500.0,
    "reward_types": [
      "Cash",
      "Hall of Fame"
    ],
    "scope_summary": [
      "Azure",
      "Hyper-V",
      "Windows",
      "Office 365",
      "Identity"
    ],
    "out_of_scope_summary": [
      "DDoS",
      "Spam",
      "Phishing"
    ],
    "contact_email": "secure@microsoft.com",
    "security_txt_url": "https://www.microsoft.com/.well-known/security.txt",
    "tags": [
      "Cloud",
      "OS",
      "Enterprise",
      "Web"
    ],
    "status": "Active",
    "last_updated": "2026-10-13T05:04:04.806078+00:00"
  },
  {
    "id": "meta-whitehat",
    "name": "Meta Bug Bounty Program",
    "organization": "Meta",
    "platform": "Direct / Self-Hosted",
    "program_type": "Bug Bounty",
    "url": "https://www.facebook.com/whitehat",
    "policy_url": "https://www.facebook.com/whitehat/info",
    "max_bounty_usd": 130000.0,
    "min_bounty_usd": 500.0,
    "reward_types": [
      "Cash",
      "Swag"
    ],
    "scope_summary": [
      "Facebook",
      "Instagram",
      "WhatsApp",
      "Oculus / Meta Quest"
    ],
    "out_of_scope_summary": [
      "Third-party apps",
      "Social engineering"
    ],
    "contact_email": "security@facebook.com",
    "security_txt_url": "https://www.facebook.com/.well-known/security.txt",
    "tags": [
      "Social",
      "Mobile",
      "VR",
      "Web"
    ],
    "status": "Active",
    "last_updated": "2026-10-13T05:04:04.806088+00:00"
  },
  {
    "id": "apple-security-bounty",
    "name": "Apple Security Bounty",
    "organization": "Apple",
    "platform": "Direct / Self-Hosted",
    "program_type": "Bug Bounty",
    "url": "https://security.apple.com/bounty/",
    "policy_url": "https://security.apple.com/bounty/",
    "max_bounty_usd": 2000000.0,
    "min_bounty_usd": 5000.0,
    "reward_types": [
      "Cash",
      "Hall of Fame"
    ],
    "scope_summary": [
      "iOS",
      "macOS",
      "watchOS",
      "iCloud",
      "Apple Web Services"
    ],
    "out_of_scope_summary": [
      "Physical attacks",
      "User data theft without authorization"
    ],
    "contact_email": "product-security@apple.com",
    "security_txt_url": "https://www.apple.com/.well-known/security.txt",
    "tags": [
      "OS",
      "Hardware",
      "Mobile",
      "Cloud"
    ],
    "status": "Active",
    "last_updated": "2026-10-13T05:04:04.806097+00:00"
  },
  {
    "id": "cisa-vdp",
    "name": "CISA Vulnerability Disclosure Policy",
    "organization": "U.S. Cybersecurity and Infrastructure Security Agency",
    "platform": "Direct / Self-Hosted",
    "program_type": "VDP (Unpaid)",
    "url": "https://www.cisa.gov/vulnerability-disclosure-policy",
    "policy_url": "https://www.cisa.gov/vulnerability-disclosure-policy",
    "max_bounty_usd": null,
    "min_bounty_usd": null,
    "reward_types": [
      "Hall of Fame"
    ],
    "scope_summary": [
      "*.cisa.gov",
      "Federal Executive Branch Systems"
    ],
    "out_of_scope_summary": [
      "DDoS",
      "Exfiltration of PII"
    ],
    "contact_email": "vdp@cisa.dhs.gov",
    "security_txt_url": "https://www.cisa.gov/.well-known/security.txt",
    "tags": [
      "Government",
      "VDP",
      "Infrastructure"
    ],
    "status": "Active",
    "last_updated": "2026-10-13T05:04:04.806144+00:00"
  },
  {
    "id": "sectxt-cloudflare-com",
    "name": "Cloudflare Security Disclosure (security.txt)",
    "organization": "Cloudflare",
    "platform": "Direct / Self-Hosted",
    "program_type": "VDP (Unpaid)",
    "url": "https://cloudflare.com",
    "policy_url": "https://www.cloudflare.com/disclosure/",
    "max_bounty_usd": null,
    "min_bounty_usd": null,
    "reward_types": [
      "Hall of Fame"
    ],
    "scope_summary": [
      "*.cloudflare.com"
    ],
    "out_of_scope_summary": [],
    "contact_email": null,
    "security_txt_url": "https://cloudflare.com/.well-known/security.txt",
    "tags": [
      "Self-Hosted",
      "RFC 9116",
      "Web"
    ],
    "status": "Active",
    "last_updated": "2026-10-13T05:04:05.873972+00:00"
  },
  {
    "id": "sectxt-stripe-com",
    "name": "Stripe Security Disclosure (security.txt)",
    "organization": "Stripe",
    "platform": "Direct / Self-Hosted",
    "program_type": "VDP (Unpaid)",
    "url": "https://stripe.com",
    "policy_url": "https://hackerone.com/stripe#overview",
    "max_bounty_usd": null,
    "min_bounty_usd": null,
    "reward_types": [
      "Hall of Fame"
    ],
    "scope_summary": [
      "*.stripe.com"
    ],
    "out_of_scope_summary": [],
    "contact_email": null,
    "security_txt_url": "https://stripe.com/.well-known/security.txt",
    "tags": [
      "Self-Hosted",
      "RFC 9116",
      "Web"
    ],
    "status": "Active",
    "last_updated": "2026-10-13T05:04:06.643898+00:00"
  },
  {
    "id": "sectxt-airbnb-com",
    "name": "Airbnb Security Disclosure (security.txt)",
    "organization": "Airbnb",
    "platform": "Direct / Self-Hosted",
    "program_type": "VDP (Unpaid)",
    "url": "https://airbnb.com",
    "policy_url": "https://hackerone.com/airbnb#overview",
    "max_bounty_usd": null,
    "min_bounty_usd": null,
    "reward_types": [
      "Hall of Fame"
    ],
    "scope_summary": [
      "*.airbnb.com"
    ],
    "out_of_scope_summary": [],
    "contact_email": null,
    "security_txt_url": "https://airbnb.com/.well-known/security.txt",
    "tags": [
      "Self-Hosted",
      "RFC 9116",
      "Web"
    ],
    "status": "Active",
    "last_updated": "2026-10-13T05:04:07.369471+00:00"
  },
  {
    "id": "sectxt-gitlab-com",
    "name": "Gitlab Security Disclosure (security.txt)",
    "organization": "Gitlab",
    "platform": "Direct / Self-Hosted",
    "program_type": "VDP (Unpaid)",
    "url": "https://gitlab.com",
    "policy_url": "https://hackerone.com/gitlab/",
    "max_bounty_usd": null,
    "min_bounty_usd": null,
    "reward_types": [
      "Hall of Fame"
    ],
    "scope_summary": [
      "*.gitlab.com"
    ],
    "out_of_scope_summary": [],
    "contact_email": null,
    "security_txt_url": "https://gitlab.com/.well-known/security.txt",
    "tags": [
      "Self-Hosted",
      "RFC 9116",
      "Web"
    ],
    "status": "Active",
    "last_updated": "2026-10-13T05:04:07.740379+00:00"
  }
]