[
  {
    "id": "github-bug-bounty",
    "name": "GitHub Bug Bounty",
    "organization": "GitHub",
    "platform": "HackerOne",
    "program_type": "Bug Bounty",
    "url": "https://hackerone.com/github",
    "policy_url": "https://bounty.github.com/",
    "max_bounty_usd": 30000.0,
    "min_bounty_usd": 617.0,
    "reward_types": [
      "Cash",
      "Swag",
      "Hall of Fame"
    ],
    "scope_summary": [
      "github.com",
      "GitHub Enterprise",
      "GitHub Actions",
      "GitHub API"
    ],
    "out_of_scope_summary": [
      "Spam",
      "Social engineering",
      "Outdated third-party packages"
    ],
    "contact_email": "support@github.com",
    "security_txt_url": "https://github.com/.well-known/security.txt",
    "tags": [
      "Web",
      "Developer Tools",
      "Cloud"
    ],
    "status": "Active",
    "last_updated": "2026-10-25T02:49:47.874600+00:00"
  },
  {
    "id": "hackerone-omarchy",
    "name": "Omarchy (HackerOne)",
    "organization": "Omarchy",
    "platform": "HackerOne",
    "program_type": "Bug Bounty",
    "url": "https://hackerone.com/omarchy",
    "policy_url": "https://hackerone.com/omarchy",
    "max_bounty_usd": 10000.0,
    "min_bounty_usd": null,
    "reward_types": [
      "Cash",
      "Swag"
    ],
    "scope_summary": [
      "*.omarchy.com"
    ],
    "out_of_scope_summary": [],
    "contact_email": null,
    "security_txt_url": null,
    "tags": [
      "Web",
      "HackerOne"
    ],
    "status": "Active",
    "last_updated": "2026-10-25T02:49:48.207173+00:00"
  },
  {
    "id": "hackerone-common_codes",
    "name": "d-you App & German EUDI Wallet Ecosystem (HackerOne)",
    "organization": "d-you App & German EUDI Wallet Ecosystem",
    "platform": "HackerOne",
    "program_type": "Bug Bounty",
    "url": "https://hackerone.com/common_codes",
    "policy_url": "https://hackerone.com/common_codes",
    "max_bounty_usd": 10000.0,
    "min_bounty_usd": null,
    "reward_types": [
      "Cash",
      "Swag"
    ],
    "scope_summary": [
      "*.common_codes.com"
    ],
    "out_of_scope_summary": [],
    "contact_email": null,
    "security_txt_url": null,
    "tags": [
      "Web",
      "HackerOne"
    ],
    "status": "Active",
    "last_updated": "2026-10-25T02:49:48.207203+00:00"
  },
  {
    "id": "hackerone-wolt",
    "name": "Wolt (HackerOne)",
    "organization": "Wolt",
    "platform": "HackerOne",
    "program_type": "Bug Bounty",
    "url": "https://hackerone.com/wolt",
    "policy_url": "https://hackerone.com/wolt",
    "max_bounty_usd": 10000.0,
    "min_bounty_usd": null,
    "reward_types": [
      "Cash",
      "Swag"
    ],
    "scope_summary": [
      "*.wolt.com"
    ],
    "out_of_scope_summary": [],
    "contact_email": null,
    "security_txt_url": null,
    "tags": [
      "Web",
      "HackerOne"
    ],
    "status": "Active",
    "last_updated": "2026-10-25T02:49:48.207212+00:00"
  },
  {
    "id": "hackerone-agoda-public",
    "name": "Agoda Public (HackerOne)",
    "organization": "Agoda Public",
    "platform": "HackerOne",
    "program_type": "Bug Bounty",
    "url": "https://hackerone.com/agoda-public",
    "policy_url": "https://hackerone.com/agoda-public",
    "max_bounty_usd": 10000.0,
    "min_bounty_usd": null,
    "reward_types": [
      "Cash",
      "Swag"
    ],
    "scope_summary": [
      "*.agoda-public.com"
    ],
    "out_of_scope_summary": [],
    "contact_email": null,
    "security_txt_url": null,
    "tags": [
      "Web",
      "HackerOne"
    ],
    "status": "Active",
    "last_updated": "2026-10-25T02:49:48.207218+00:00"
  },
  {
    "id": "hackerone-coupang_tw",
    "name": "Coupang Taiwan (HackerOne)",
    "organization": "Coupang Taiwan",
    "platform": "HackerOne",
    "program_type": "Bug Bounty",
    "url": "https://hackerone.com/coupang_tw",
    "policy_url": "https://hackerone.com/coupang_tw",
    "max_bounty_usd": 10000.0,
    "min_bounty_usd": null,
    "reward_types": [
      "Cash",
      "Swag"
    ],
    "scope_summary": [
      "*.coupang_tw.com"
    ],
    "out_of_scope_summary": [],
    "contact_email": null,
    "security_txt_url": null,
    "tags": [
      "Web",
      "HackerOne"
    ],
    "status": "Active",
    "last_updated": "2026-10-25T02:49:48.207227+00:00"
  }
]